{
  "id": "gw2-gameplay-49key",
  "name": "GW2 Gameplay (49-key)",
  "autoOctaveSwap": false,
  "notes": {
    "C2":  { "key": "1" },
    "C#2": { "key": "2" },
    "D2":  { "key": "3" },
    "D#2": { "key": "4" },
    "E2":  { "key": "5" },
    "F2":  { "key": "6" },
    "F#2": { "key": "7" },
    "G2":  { "key": "8" },
    "G#2": { "key": "9" },
    "A2":  { "key": "0" },
    "A#2": { "key": "F1" },
    "B2":  { "key": "F2" },

    "C3":  { "key": "F3" },
    "C#3": { "key": "F4" },
    "D3":  { "key": "F" },
    "D#3": { "key": "V" },
    "E3":  { "key": "SPACE" },
    "F3":  { "key": "B" },
    "F#3": { "key": "R" },
    "G3":  { "key": "T" },
    "G#3": { "key": "C" },
    "A3":  { "key": "X" },
    "A#3": { "key": "Z" },
    "B3":  { "key": "G" },

    "C4":  { "key": "I" },
    "C#4": { "key": "H" },
    "D4":  { "key": "Y" },
    "D#4": { "key": "U" },
    "E4":  { "key": "J" },
    "F4":  { "key": "K" },
    "F#4": { "key": "L" },
    "G4":  { "key": "O" },
    "G#4": { "key": "P" },
    "A4":  { "key": "N" },
    "A#4": { "key": "M" },
    "B4":  { "key": "Q" },

    "C5":  { "key": "W" },
    "C#5": { "key": "E" },
    "D5":  { "key": "A" },
    "D#5": { "key": "S" },
    "E5":  { "key": "D" },
    "F5":  { "key": "ESC" },
    "F#5": { "key": "ENTER" },
    "G5":  { "key": "TAB" },
    "G#5": { "key": "BACKSPACE" },
    "A5":  { "key": "F5" },
    "A#5": { "key": "F6" },
    "B5":  { "key": "F7" },

    "C6":  { "key": "F8" }
  }
}
